<?xml version="1.0" encoding="UTF-8"?>
<dataroot xmlns:od="urn:schemas-microsoft-com:officedata" xmlns:xsi="https://www.w3.org/2001/XMLSchema-instance"  xsi:noNamespaceSchemaLocation="Employees.xsd" generated="2005-10-20T17:16:12">
<Employees>
<EmployeeID>1</EmployeeID>
<LastName>Davolio</LastName>
<FirstName>Nancy</FirstName>
<Title>Sales Representative</Title>
<TitleOfCourtesy>Ms.</TitleOfCourtesy>
<BirthDate>1968-12-08T00:00:00</BirthDate>
<HireDate>1992-05-01T00:00:00</HireDate>
<Address>507 - 20th Ave. E.
Apt. 2A</Address>
<City>Seattle</City>
<Region>WA</Region>
<PostalCode>98122</PostalCode>
<Country>USA</Country>
<HomePhone>(206) 555-9857</HomePhone>
<Extension>5467</Extension>
<Photo>EmpID1.bmp</Photo>
<Notes>Education includes a BA in psychology from Colorado State University.  She also completed &quot;The Art of the Cold Call.&quot;  Nancy is a member of Toastmasters International.</Notes>
<ReportsTo>2</ReportsTo>
</Employees>
</dataroot>
